{
  "schema_version": "2.0",
  "slug": "project-management",
  "purpose": "通过事件状态、检查点、风险和产物血缘治理科研项目",
  "entry_criteria": [
    "scientific objective recorded",
    "inputs classified by provenance"
  ],
  "inputs": [
    "workflow-specific inputs"
  ],
  "artifacts": [
    "workflow-specific artifacts"
  ],
  "phases": [
    "建立WBS、所有者和依赖DAG",
    "定义里程碑和验收标准",
    "记录风险、决策和审批",
    "创建检查点并检测陈旧产物",
    "从哈希事件链恢复状态"
  ],
  "decisions": [
    "do not claim unavailable execution",
    "retain contradictory and null evidence",
    "high-risk final decisions require qualified review"
  ],
  "failure_modes": [
    "missing inputs",
    "validation failure",
    "tool unavailable"
  ],
  "recovery": [
    "record event",
    "preserve partial artifacts",
    "resume from last valid checkpoint"
  ],
  "validators": [
    "schema",
    "state",
    "evidence",
    "artifact"
  ]
}
