{
  "schema_version": "2.0",
  "slug": "data-analysis",
  "purpose": "从数据生成机制出发执行质量、统计、UQ与科学ML",
  "entry_criteria": [
    "scientific objective recorded",
    "inputs classified by provenance"
  ],
  "inputs": [
    "workflow-specific inputs"
  ],
  "artifacts": [
    "workflow-specific artifacts"
  ],
  "phases": [
    "登记来源、许可、校验和与单位",
    "检查缺失、重复、异常、批次和物理边界",
    "识别依赖、聚类、删失和重复测量",
    "选择统计或ML子协议并诊断假设",
    "报告效应量、区间、多重性、泄漏和适用域"
  ],
  "decisions": [
    "do not claim unavailable execution",
    "retain contradictory and null evidence",
    "high-risk final decisions require qualified review"
  ],
  "failure_modes": [
    "missing inputs",
    "validation failure",
    "tool unavailable"
  ],
  "recovery": [
    "record event",
    "preserve partial artifacts",
    "resume from last valid checkpoint"
  ],
  "validators": [
    "schema",
    "state",
    "evidence",
    "artifact"
  ]
}
