{
  "schema_version": "2.0",
  "slug": "systematic-review",
  "purpose": "冻结协议后执行系统综述与证据综合",
  "entry_criteria": [
    "scientific objective recorded",
    "inputs classified by provenance"
  ],
  "inputs": [
    "workflow-specific inputs"
  ],
  "artifacts": [
    "workflow-specific artifacts"
  ],
  "phases": [
    "冻结问题、纳排标准和检索式",
    "设计双筛与分歧解决",
    "记录PRISMA和排除理由",
    "选择偏倚工具与效应量",
    "检查异质性、发表偏倚和确定性"
  ],
  "decisions": [
    "do not claim unavailable execution",
    "retain contradictory and null evidence",
    "high-risk final decisions require qualified review"
  ],
  "failure_modes": [
    "missing inputs",
    "validation failure",
    "tool unavailable"
  ],
  "recovery": [
    "record event",
    "preserve partial artifacts",
    "resume from last valid checkpoint"
  ],
  "validators": [
    "schema",
    "state",
    "evidence",
    "artifact"
  ]
}
